{
  "format": "ki-lead-pruefstein/1",
  "id": "2026-W43_ebola-kenia-nigeria",
  "hinweis": "KI-Entwurf im Erfassungstest zu einer realen Lage – keine amtliche Meldung, keine Musterlösung.",
  "lauf": {
    "agent": "erfassungstest",
    "erstellt_utc": "2026-10-24T11:00Z",
    "modell": "claude-opus-5-5"
  },
  "regelwerk": {
    "commit": "fbfe50b73b643f2744d890ea4e3ad286e4ef5d14",
    "sop_mappe": "3.16.0",
    "kodierleitfaden": "1.3.0",
    "anweisung_erfassung": "1.4.0",
    "schema": "LEAD-Meldung-v1"
  },
  "lage": {
    "titel": "Ebola (Bundibugyo-Virus): Übertragungskette in Kenia und Fall in Nigeria, Stand 23.10.2026",
    "t0": "2026-10-24T13:00",
    "referenzraum": "Bund (Bevölkerungsschutz in Deutschland)",
    "ereignisarten": [
      "Gesundheitliche Lage / Epidemie"
    ],
    "sop": [
      "B11",
      "C07",
      "C09"
    ]
  },
  "quellen": [
    {
      "url": "https://www.ecdc.europa.eu/en/news-events/importation-ebola-cases-kenya-and-nigeria-ecdc-assesses-threat",
      "herausgeber": "ECDC",
      "abgerufen_utc": "2026-10-24T10:52Z"
    },
    {
      "url": "https://www.rki.de/DE/Themen/Infektionskrankheiten/Infektionskrankheiten-A-Z/E/Ebola/Ausbruch-DRC-2026.html",
      "herausgeber": "Robert Koch-Institut",
      "abgerufen_utc": "2026-10-24T10:50Z"
    },
    {
      "url": "https://www.ecdc.europa.eu/en/ebola-outbreak-democratic-republic-congo-and-uganda",
      "herausgeber": "ECDC",
      "abgerufen_utc": "2026-10-24T10:50Z"
    },
    {
      "url": "https://www.ecdc.europa.eu/sites/default/files/documents/communicable-disease-threats-report-week-42-2026.pdf",
      "herausgeber": "ECDC",
      "abgerufen_utc": "2026-10-24T10:50Z"
    },
    {
      "url": "https://afro.who.int/sites/default/files/2026-10/Week%2041%20Situation%20Report.pdf",
      "herausgeber": "WHO-Regionalbüro für Afrika",
      "abgerufen_utc": "2026-10-24T10:50Z"
    }
  ],
  "einstufung": [
    "brauchbar",
    "unvollstaendig"
  ],
  "maengel": [
    {
      "beschreibung": "Empfehlung zum räumlichen Zuschnitt der Reisendeninformation ohne Anker in C07 frei abgeleitet.",
      "stelle": "sachverhalte[0].analyse.massnahmen_empfehlungen",
      "befund": "ET-2026-W43-03"
    },
    {
      "beschreibung": "eintritt auf das Datum des Bekanntwerdens (15.05.2026) gesetzt; nach der Arbeitsanweisung wäre nur ein belegter Beginn zulässig, sonst leer.",
      "stelle": "sachverhalte[0].eintritt"
    },
    {
      "beschreibung": "Teilreisewarnung des Auswärtigen Amts nur über RKI-Verweis wiedergegeben, Originalseite nicht abgerufen.",
      "stelle": "sachverhalte[0].analyse.massnahmen_empfehlungen"
    },
    {
      "beschreibung": "D2 offen, obwohl die Entlassung beider Patienten einen Nullbefund nahelegt; Auslegung der Nullregel (b) ungeklärt.",
      "stelle": "sachverhalte[0].sofort.lagenradar.d2"
    }
  ],
  "befunde": [
    "ET-2026-W43-03"
  ]
}