{
  "format": "ki-lead-pruefstein/1",
  "id": "2026-W43_eichstaett-cyberangriff",
  "hinweis": "KI-Entwurf im Erfassungstest zu einer realen Lage – keine amtliche Meldung, keine Musterlösung.",
  "lauf": {
    "agent": "erfassungstest",
    "erstellt_utc": "2026-10-24T11:00Z",
    "modell": "claude-opus-5-5"
  },
  "regelwerk": {
    "commit": "fbfe50b73b643f2744d890ea4e3ad286e4ef5d14",
    "sop_mappe": "3.16.0",
    "kodierleitfaden": "1.3.0",
    "anweisung_erfassung": "1.4.0",
    "schema": "LEAD-Meldung-v1"
  },
  "lage": {
    "titel": "Erpressungsangriff mit Datenabfluss auf die Stadtverwaltung Eichstätt (Bayern), Notbetrieb seit 12.10.2026",
    "t0": "2026-10-24T13:00",
    "referenzraum": "Bund (Bevölkerungsschutz in Deutschland)",
    "ereignisarten": [
      "Cyberangriff / IT-Sicherheitsvorfall"
    ],
    "sop": [
      "B15",
      "C11"
    ]
  },
  "quellen": [
    {
      "url": "https://www.eichstaett.de/aktuelles/cyber-attacke_stadtverwaltung-2841/",
      "herausgeber": "Stadt Eichstätt",
      "abgerufen_utc": "2026-10-24T10:50Z"
    },
    {
      "url": "https://www.eichstaett.de/aktuelles/cyber-attacke_krisenstab_faehr-2843",
      "herausgeber": "Stadt Eichstätt",
      "abgerufen_utc": "2026-10-24T10:50Z"
    },
    {
      "url": "https://www.eichstaett.de/aktuelles/cyber-attacke_stadtverwaltung-2845",
      "herausgeber": "Stadt Eichstätt",
      "abgerufen_utc": "2026-10-24T10:50Z"
    },
    {
      "url": "https://www.eichstaett.de/aktuelles/cyber-attacke_stadt_eichstaett-2849/",
      "herausgeber": "Stadt Eichstätt",
      "abgerufen_utc": "2026-10-24T10:50Z"
    },
    {
      "url": "https://www.eichstaett.de/aktuelles/cyber-attacke_wiederhochfahren-2855",
      "herausgeber": "Stadt Eichstätt",
      "abgerufen_utc": "2026-10-24T10:50Z"
    },
    {
      "url": "https://www.eichstaett.de/aktuelles/cyber-attacke_erste_server_sin-2857",
      "herausgeber": "Stadt Eichstätt",
      "abgerufen_utc": "2026-10-24T10:50Z"
    },
    {
      "url": "https://www.eichstaett.de/aktuelles/cyber-attacke_auf_stadtverwalt-2861",
      "herausgeber": "Stadt Eichstätt",
      "abgerufen_utc": "2026-10-24T10:50Z"
    },
    {
      "url": "https://www.eichstaett.de/cyberangriff",
      "herausgeber": "Stadt Eichstätt",
      "abgerufen_utc": "2026-10-24T10:50Z"
    },
    {
      "url": "https://www.eichstaett.de/aktuelles/cyber-attacke_stadt_eichstaett-2851/",
      "herausgeber": "Stadt Eichstätt",
      "abgerufen_utc": "2026-10-24T10:50Z"
    }
  ],
  "einstufung": [
    "unvollstaendig"
  ],
  "maengel": [
    {
      "beschreibung": "Folgen des Datenabflusses (Veröffentlichung, Information Betroffener, Täuschung im Namen der Behörde) ohne Prüffrage frei ergänzt; B15 bietet dafür keinen Anker.",
      "stelle": "sachverhalte[0].analyse.risiken_auswirkungen",
      "befund": "ET-2026-W43-02"
    },
    {
      "beschreibung": "D2 offen mit eigener Auslegung, dass Verwaltungsleistungen keine Grundversorgung sind; andere Bearbeitung könnte die Einwohnerzahl ansetzen.",
      "stelle": "sachverhalte[0].sofort.lagenradar.d2",
      "befund": "ET-2026-W43-05"
    },
    {
      "beschreibung": "D5 offen, obwohl eine Mindestprognose der Stadt vorlag; Umgang mit „mindestens bis …“ ungeregelt.",
      "stelle": "sachverhalte[0].sofort.lagenradar.d5",
      "befund": "ET-2026-W43-04"
    },
    {
      "beschreibung": "D4 = 4 nach Unterstützung durch eine einzelne beratende Landesfachstelle; Stufentext „landesweit“ trägt das nur bedingt, D4 = 2 oder offen wären vertretbar.",
      "stelle": "sachverhalte[0].sofort.lagenradar.d4"
    },
    {
      "beschreibung": "D6 = 1 („peripher“) nur mit E-Mail-Ausfall eines Pflegeheims begründet; D6 = 0 wäre ebenso vertretbar.",
      "stelle": "sachverhalte[0].sofort.lagenradar.d6"
    },
    {
      "beschreibung": "eintritt 09.10.2026 gewählt, obwohl die Stadt den Beginn in der Nacht vom 08. auf den 09.10. verortet und frühere Mitteilungen andere Zeitpunkte nannten.",
      "stelle": "sachverhalte[0].eintritt"
    },
    {
      "beschreibung": "Richtwerte überschritten: Analysefelder rund 5.000 Zeichen, Bewertungstext rund 2.400 Zeichen.",
      "stelle": "sachverhalte[0].sofort.bewertung_text"
    },
    {
      "beschreibung": "C11 geprüft, aber nur in der Begleitnotiz genannt; die Meldung führt in _entstehung.sop nur B15.",
      "stelle": "_entstehung.sop"
    }
  ],
  "befunde": [
    "ET-2026-W43-02",
    "ET-2026-W43-04",
    "ET-2026-W43-05"
  ]
}