{
  "format": "ki-lead-pruefstein/1",
  "id": "2026-W43_wiesbaden-abkochgebot",
  "hinweis": "KI-Entwurf im Erfassungstest zu einer realen Lage – keine amtliche Meldung, keine Musterlösung.",
  "lauf": {
    "agent": "erfassungstest",
    "erstellt_utc": "2026-10-24T11:00Z",
    "modell": "claude-opus-5-5"
  },
  "regelwerk": {
    "commit": "fbfe50b73b643f2744d890ea4e3ad286e4ef5d14",
    "sop_mappe": "3.16.0",
    "kodierleitfaden": "1.3.0",
    "anweisung_erfassung": "1.4.0",
    "schema": "LEAD-Meldung-v1"
  },
  "lage": {
    "titel": "Abkochgebot für Teile der Wiesbadener Innenstadt nach Pseudomonas-Befund (25.09.–17.10.2026), Meldung im Nachlauf",
    "t0": "2026-10-24T13:00",
    "referenzraum": "Bund (Bevölkerungsschutz in Deutschland)",
    "ereignisarten": [
      "Trinkwasserversorgung"
    ],
    "sop": [
      "B10",
      "C09",
      "C15"
    ]
  },
  "quellen": [
    {
      "url": "https://www.wiesbaden.de/pressemitteilungen/pressereferat/oktober/abkochgebot-fuer-trinkwasser-mit-sofortiger-wirkung-aufgehoben",
      "herausgeber": "Landeshauptstadt Wiesbaden",
      "abgerufen_utc": "2026-10-24T10:50Z"
    },
    {
      "url": "https://www.wiesbaden.de/pressemitteilungen/pressereferat/september/vorsorgliches-abkochgebot-fuer-trinkwasser-in-der-innenstadt",
      "herausgeber": "Landeshauptstadt Wiesbaden",
      "abgerufen_utc": "2026-10-24T10:50Z"
    },
    {
      "url": "https://www.wiesbaden.de/pressemitteilungen/pressereferat/september/aktualisierung-neue-strassenliste-vorsorgliches-abkochgebot-fuer-trinkwasser-in-der-innenstadt",
      "herausgeber": "Landeshauptstadt Wiesbaden",
      "abgerufen_utc": "2026-10-24T10:50Z"
    },
    {
      "url": "https://www.wiesbaden.de/uk/pressemitteilungen/pressereferat/oktober/trinkwasser-aktuelle-proben-unauffaellig-aufhebung-des-abkochgebots-fruehestens-samstag-moeglich",
      "herausgeber": "Landeshauptstadt Wiesbaden",
      "abgerufen_utc": "2026-10-24T10:50Z"
    },
    {
      "url": "https://wiesbadenaktuell.de/2026/10/08/keine-entwarnung-beim-trinkwasser-abkochgebot-fuer-wiesbadener-innenstadt-bleibt-bestehen/",
      "herausgeber": "wiesbadenaktuell.de",
      "abgerufen_utc": "2026-10-24T10:50Z"
    },
    {
      "url": "https://www.wiesbaden.de/uk/pressemitteilungen/pressereferat/2025/oktober/251031-Vorsorgliches-Abkochgebot-fuer-Trinkwasser",
      "herausgeber": "Landeshauptstadt Wiesbaden",
      "abgerufen_utc": "2026-10-24T10:50Z"
    },
    {
      "url": "https://piwi.wiesbaden.de/dokument/v/3566895",
      "herausgeber": "Landeshauptstadt Wiesbaden",
      "abgerufen_utc": "2026-10-24T10:50Z"
    }
  ],
  "einstufung": [
    "unvollstaendig",
    "widerspruechlich"
  ],
  "maengel": [
    {
      "beschreibung": "Ist-Kodierung zu t0 nach Aufhebung: D1 und D2 offen, D5 = 0 und D6 = 0; das Radar bildet das beendete Ereignis nicht ab und behandelt die Achsen ungleich.",
      "stelle": "sachverhalte[0].sofort.lagenradar",
      "befund": "ET-2026-W43-01"
    },
    {
      "beschreibung": "D3 = 2 für das Gesundheitsamt einer kreisfreien Stadt gesetzt; D3 = 1 wäre nach den Stufentexten ebenso vertretbar.",
      "stelle": "sachverhalte[0].sofort.lagenradar.d3",
      "befund": "ET-2026-W43-06"
    },
    {
      "beschreibung": "Wiederholung im selben Versorgungsgebiet ohne SOP-Anker frei als Kernaussage aufgenommen.",
      "stelle": "sachverhalte[0].sofort.bewertung_text",
      "befund": "ET-2026-W43-07"
    },
    {
      "beschreibung": "Betroffenes Gebiet und Einwohnerzahl nicht ermittelt, weil die PDF-Anlagen nicht ausgewertet wurden; Einrichtungen im Gebiet (B10/R7) daher ungeprüft.",
      "stelle": "sachverhalte[0].analyse.risiken_auswirkungen"
    },
    {
      "beschreibung": "Zwei Quellen in der ukrainischen Sprachfassung der städtischen Seite zitiert statt der deutschen Ausgangsseite.",
      "stelle": "quellen"
    },
    {
      "beschreibung": "Aussagen zur Warnung 2025 stützen sich auf ein Ausschussprotokoll, das Bürgerbeschwerden wiedergibt; als Beleg einer Warnlücke nur indirekt.",
      "stelle": "sachverhalte[0].analyse.risiken_auswirkungen"
    }
  ],
  "befunde": [
    "ET-2026-W43-01",
    "ET-2026-W43-06",
    "ET-2026-W43-07"
  ]
}